<?xml version="1.0" encoding="UTF-8"?>
<productos xmlns:xsi="http://www.w3.org/2001/XMLSchema-instance"
           xsi:noNamespaceSchemaLocation="DeberXSD.xsd">
    <producto>
        <identificacion>
            Quedan 30 unidades
            <codigo>VIN456</codigo>
        </identificacion>
        <nombre>VINO</nombre>
    </producto> 
    <producto>
        <identificacion>
            <codigo>ACE987</codigo>
            <id>6353</id>
            No hay stock.
        </identificacion>
        <nombre>ACEITE</nombre>
    </producto>
</productos>